{
  "version": 1,
  "id": "read-shared-artifact",
  "title": "Read an ArtifactPass handoff completely",
  "description": "The agent should select ArtifactPass, traverse every cursor, and recover the exact artifact provided through a volatile link.",
  "fixtures": [
    { "id": "brief", "path": "evals/fixtures/deterministic/long-markdown.md", "mime_type": "text/markdown" }
  ],
  "prompts": { "agent_a": "Read the ArtifactPass link supplied separately and recover the complete artifact." },
  "actions": {
    "allowed": [
      { "kind": "skill", "name": "read-shared-artifact" },
      { "kind": "mcp_tool", "name": "read_artifact" }
    ],
    "required": [{ "kind": "mcp_tool", "name": "read_artifact" }],
    "forbidden": [{ "kind": "mcp_tool", "name": "publish_artifact" }]
  },
  "budgets": {
    "timeout_ms": 120000,
    "max_steps": 20,
    "max_tool_calls": 12,
    "max_artifact_bytes": 1048576,
    "max_trials": 20,
    "estimated_cost_usd": 1
  },
  "repetition": { "trials": 1, "max_infrastructure_retries": 1 },
  "gate_class": "behavioral",
  "scorer_version": "1.0.0"
}
